{
  "schema_version": 1,
  "id": "kv260_async_fifo",
  "title": "KV260 dual-clock Gray-pointer FIFO",
  "prompt_file": "prompt.md",
  "target": {"part": "xck26-sfvc784-2LV-c", "board_part": "xilinx.com:kv260_som:part0:1.4", "vivado_version": "2025.2"},
  "expected_route": ["amd_soc_orchestrator", "amd_soc_intent_to_spec", "amd_soc_architect", "vivado_rtl_engineer", "amd_soc_platform_integrator", "amd_soc_verifier", "vivado_impl_closure"],
  "candidate": {"integration_mode": "ip_integrator", "top": "kv260_async_fifo", "simulation_top": "kv260_async_fifo", "rtl_sources": ["rtl/kv260_async_fifo.sv"], "constraint_sources": []},
  "public_interface": {
    "design_root": "design",
    "modules": [{
      "name": "kv260_async_fifo",
      "source": "rtl/kv260_async_fifo.sv",
      "roles": ["simulation_top", "required_component"],
      "parameters": [],
      "ports": [
        {"name": "wr_clk", "direction": "input", "width": 1},
        {"name": "wr_rst", "direction": "input", "width": 1},
        {"name": "wr_en", "direction": "input", "width": 1},
        {"name": "wr_data", "direction": "input", "width": 32},
        {"name": "full", "direction": "output", "width": 1},
        {"name": "rd_clk", "direction": "input", "width": 1},
        {"name": "rd_rst", "direction": "input", "width": 1},
        {"name": "rd_en", "direction": "input", "width": 1},
        {"name": "rd_data", "direction": "output", "width": 32},
        {"name": "empty", "direction": "output", "width": 1}
      ]
    }],
    "constraints": []
  },
  "simulation": {"make_directory": "testbench", "toplevel": "kv260_async_fifo"},
  "semantic_rubric": [
    {"id": "SEM-DIRECT-RTL", "weight": 10, "artifact": "architecture-plan.json", "collection": "modules", "match": {"name": "kv260_async_fifo"}, "field": "implementation", "operator": "equals", "expected": "rtl"},
    {"id": "SEM-RTL-OWNER", "weight": 10, "artifact": "architecture-plan.json", "collection": "modules", "match": {"name": "kv260_async_fifo"}, "field": "owner", "operator": "equals", "expected": "vivado_rtl_engineer"},
    {"id": "SEM-II-ONE", "weight": 10, "artifact": "architecture-plan.json", "collection": "modules", "match": {"name": "kv260_async_fifo"}, "field": "performance.initiation_interval_max", "operator": "equals", "expected": 1},
    {"id": "SEM-NO-HLS", "weight": 10, "artifact": "architecture-plan.json", "collection": "work_packages", "field": "agent", "operator": "not_contains", "expected": "vitis_hls_engineer"}
  ],
  "score_weights": {"contracts": 10, "semantics": 40, "simulation": 30, "vivado": 20}
}
