{
  "schema_version": 1,
  "id": "kv260_crc32_stream",
  "title": "KV260 byte-stream CRC-32 engine",
  "prompt_file": "prompt.md",
  "target": {
    "part": "xck26-sfvc784-2LV-c",
    "board_part": "xilinx.com:kv260_som:part0:1.4",
    "vivado_version": "2025.2"
  },
  "expected_route": [
    "amd_soc_orchestrator",
    "amd_soc_intent_to_spec",
    "amd_soc_architect",
    "vivado_rtl_engineer",
    "amd_soc_platform_integrator",
    "amd_soc_verifier",
    "vivado_impl_closure"
  ],
  "candidate": {
    "integration_mode": "ip_integrator",
    "top": "kv260_crc32_stream",
    "simulation_top": "kv260_crc32_stream",
    "rtl_sources": ["rtl/kv260_crc32_stream.sv"],
    "constraint_sources": []
  },
  "public_interface": {
    "design_root": "design",
    "modules": [{
      "name": "kv260_crc32_stream",
      "source": "rtl/kv260_crc32_stream.sv",
      "roles": ["simulation_top", "required_component"],
      "parameters": [],
      "ports": [
        {"name": "clk", "direction": "input", "width": 1},
        {"name": "rst", "direction": "input", "width": 1},
        {"name": "s_axis_tvalid", "direction": "input", "width": 1},
        {"name": "s_axis_tready", "direction": "output", "width": 1},
        {"name": "s_axis_tdata", "direction": "input", "width": 8},
        {"name": "s_axis_tlast", "direction": "input", "width": 1},
        {"name": "crc_valid", "direction": "output", "width": 1},
        {"name": "crc_ready", "direction": "input", "width": 1},
        {"name": "crc_data", "direction": "output", "width": 32}
      ]
    }],
    "constraints": []
  },
  "simulation": {"make_directory": "testbench", "toplevel": "kv260_crc32_stream"},
  "semantic_rubric": [
    {"id": "SEM-DIRECT-RTL", "weight": 10, "artifact": "architecture-plan.json", "collection": "modules", "match": {"name": "kv260_crc32_stream"}, "field": "implementation", "operator": "equals", "expected": "rtl"},
    {"id": "SEM-RTL-OWNER", "weight": 10, "artifact": "architecture-plan.json", "collection": "modules", "match": {"name": "kv260_crc32_stream"}, "field": "owner", "operator": "equals", "expected": "vivado_rtl_engineer"},
    {"id": "SEM-II-ONE", "weight": 10, "artifact": "architecture-plan.json", "collection": "modules", "match": {"name": "kv260_crc32_stream"}, "field": "performance.initiation_interval_max", "operator": "equals", "expected": 1},
    {"id": "SEM-NO-HLS", "weight": 10, "artifact": "architecture-plan.json", "collection": "work_packages", "field": "agent", "operator": "not_contains", "expected": "vitis_hls_engineer"}
  ],
  "score_weights": {"contracts": 10, "semantics": 40, "simulation": 30, "vivado": 20}
}
