{
  "schema_version":1,"id":"kv260_multimedia_appliance","title":"KV260 multimedia appliance controller","prompt_file":"prompt.md",
  "target":{"part":"xck26-sfvc784-2LV-c","board_part":"xilinx.com:kv260_som:part0:1.4","vivado_version":"2025.2"},
  "expected_route":["amd_soc_orchestrator","amd_soc_intent_to_spec","amd_soc_architect","vivado_rtl_engineer","amd_soc_platform_integrator","amd_soc_verifier","vivado_impl_closure"],
  "candidate":{"integration_mode":"ip_integrator","top":"kv260_multimedia_appliance","simulation_top":"kv260_multimedia_appliance","rtl_sources":["rtl/kv260_multimedia_appliance.sv"],"constraint_sources":[]},
  "public_interface":{"design_root":"design","modules":[{"name":"kv260_multimedia_appliance","source":"rtl/kv260_multimedia_appliance.sv","roles":["simulation_top","required_component"],"parameters":[],"ports":[
    {"name":"clk","direction":"input","width":1},{"name":"rst_n","direction":"input","width":1},{"name":"start","direction":"input","width":1},{"name":"clear","direction":"input","width":1},
    {"name":"target_frames","direction":"input","width":16},{"name":"target_audio_blocks","direction":"input","width":16},{"name":"frame_event","direction":"input","width":1},
    {"name":"audio_event","direction":"input","width":1},{"name":"ddr_error","direction":"input","width":1},{"name":"abort","direction":"input","width":1},
    {"name":"busy","direction":"output","width":1},{"name":"done","direction":"output","width":1},{"name":"pass","direction":"output","width":1},
    {"name":"error_code","direction":"output","width":16},{"name":"frame_count","direction":"output","width":16},{"name":"audio_count","direction":"output","width":16}
  ]}],"constraints":[]},
  "simulation":{"make_directory":"testbench","toplevel":"kv260_multimedia_appliance"},
  "semantic_rubric":[
    {"id":"SEM-KERNEL-RTL","weight":10,"artifact":"architecture-plan.json","collection":"modules","match":{"name":"kv260_multimedia_appliance"},"field":"implementation","operator":"equals","expected":"rtl"},
    {"id":"SEM-RTL-OWNER","weight":10,"artifact":"architecture-plan.json","collection":"modules","match":{"name":"kv260_multimedia_appliance"},"field":"owner","operator":"equals","expected":"vivado_rtl_engineer"},
    {"id":"SEM-PLATFORM","weight":10,"artifact":"architecture-plan.json","collection":"work_packages","field":"agent","operator":"contains","expected":"amd_soc_platform_integrator"},
    {"id":"SEM-NO-HLS","weight":10,"artifact":"architecture-plan.json","collection":"work_packages","field":"agent","operator":"not_contains","expected":"vitis_hls_engineer"}],
  "score_weights":{"contracts":10,"semantics":40,"simulation":30,"vivado":20}
}
