{
  "schema_version": 1,
  "id": "kv260_watchdog_irq",
  "title": "KV260 Watchdog Interrupt",
  "prompt_file": "prompt.md",
  "target": {
    "part": "xck26-sfvc784-2LV-c",
    "board_part": "xilinx.com:kv260_som:part0:1.4",
    "vivado_version": "2025.2"
  },
  "expected_route": [
    "amd_soc_orchestrator",
    "amd_soc_intent_to_spec",
    "amd_soc_architect",
    "vivado_rtl_engineer",
    "amd_soc_platform_integrator",
    "amd_soc_verifier",
    "vivado_impl_closure"
  ],
  "candidate": {
    "integration_mode": "ip_integrator",
    "top": "kv260_system_wrapper",
    "simulation_top": "kv260_watchdog_irq",
    "rtl_sources": ["rtl/kv260_watchdog_irq.sv"],
    "constraint_sources": []
  },
  "public_interface": {
    "design_root": "design",
    "modules": [{
      "name": "kv260_watchdog_irq",
      "source": "rtl/kv260_watchdog_irq.sv",
      "roles": ["simulation_top", "required_component"],
      "parameters": [],
      "ports": [
        {"name": "clk", "direction": "input", "width": 1},
        {"name": "resetn", "direction": "input", "width": 1},
        {"name": "enable", "direction": "input", "width": 1},
        {"name": "reload", "direction": "input", "width": 1},
        {"name": "clear_expired", "direction": "input", "width": 1},
        {"name": "timeout_cycles", "direction": "input", "width": 32},
        {"name": "irq_o", "direction": "output", "width": 1},
        {"name": "expired_sticky_o", "direction": "output", "width": 1}
      ]
    }],
    "constraints": []
  },
  "simulation": {"make_directory": "testbench", "toplevel": "kv260_watchdog_irq"},
  "semantic_rubric": [
    {"id": "RTL_FILE", "weight": 4, "artifact": "source-manifest.json", "collection": "files", "match": {"path": "design/rtl/kv260_watchdog_irq.sv"}, "field": "kind", "operator": "equals", "expected": "rtl"},
    {"id": "RTL_OWNER", "weight": 3, "artifact": "architecture-plan.json", "collection": "modules", "match": {"name": "kv260_watchdog_irq"}, "field": "owner", "operator": "equals", "expected": "vivado_rtl_engineer"},
    {"id": "PLATFORM_INTEGRATION", "weight": 2, "artifact": "architecture-plan.json", "collection": "work_packages", "match": {"agent": "amd_soc_platform_integrator"}, "field": "agent", "operator": "equals", "expected": "amd_soc_platform_integrator"},
    {"id": "NO_HLS", "weight": 1, "artifact": "architecture-plan.json", "collection": "modules", "field": "implementation", "operator": "not_contains", "expected": "hls"}
  ],
  "score_weights": {"contracts": 20, "semantics": 20, "simulation": 30, "vivado": 30}
}
