{
  "schema_version": 1,
  "id": "kv260_adaptive_threshold",
  "title": "KV260 local-mean adaptive threshold",
  "prompt_file": "prompt.md",
  "target": {
    "part": "xck26-sfvc784-2LV-c",
    "board_part": "xilinx.com:kv260_som:part0:1.4",
    "vivado_version": "2025.2"
  },
  "expected_route": [
    "amd_soc_orchestrator",
    "amd_soc_intent_to_spec",
    "amd_soc_architect",
    "vivado_rtl_engineer",
    "amd_soc_platform_integrator",
    "amd_soc_verifier",
    "vivado_impl_closure"
  ],
  "candidate": {
    "integration_mode": "ip_integrator",
    "top": "kv260_adaptive_threshold",
    "simulation_top": "kv260_adaptive_threshold",
    "rtl_sources": [
      "rtl/kv260_adaptive_threshold.sv"
    ],
    "constraint_sources": []
  },
  "public_interface": {
    "design_root": "design",
    "modules": [
      {
        "name": "kv260_adaptive_threshold",
        "source": "rtl/kv260_adaptive_threshold.sv",
        "roles": [
          "simulation_top",
          "required_component"
        ],
        "parameters": [],
        "ports": [
          {
            "name": "clk",
            "direction": "input",
            "width": 1
          },
          {
            "name": "rst_n",
            "direction": "input",
            "width": 1
          },
          {
            "name": "s_valid",
            "direction": "input",
            "width": 1
          },
          {
            "name": "s_ready",
            "direction": "output",
            "width": 1
          },
          {
            "name": "s_pixel",
            "direction": "input",
            "width": 8
          },
          {
            "name": "s_mean",
            "direction": "input",
            "width": 8
          },
          {
            "name": "threshold_offset",
            "direction": "input",
            "width": 8
          },
          {
            "name": "s_user",
            "direction": "input",
            "width": 1
          },
          {
            "name": "s_last",
            "direction": "input",
            "width": 1
          },
          {
            "name": "m_valid",
            "direction": "output",
            "width": 1
          },
          {
            "name": "m_ready",
            "direction": "input",
            "width": 1
          },
          {
            "name": "m_mask",
            "direction": "output",
            "width": 8
          },
          {
            "name": "m_user",
            "direction": "output",
            "width": 1
          },
          {
            "name": "m_last",
            "direction": "output",
            "width": 1
          }
        ]
      }
    ],
    "constraints": []
  },
  "simulation": {
    "make_directory": "testbench",
    "toplevel": "kv260_adaptive_threshold"
  },
  "semantic_rubric": [
    {
      "id": "SEM-KERNEL-RTL",
      "weight": 10,
      "artifact": "architecture-plan.json",
      "collection": "modules",
      "match": {
        "name": "kv260_adaptive_threshold"
      },
      "field": "implementation",
      "operator": "equals",
      "expected": "rtl"
    },
    {
      "id": "SEM-RTL-OWNER",
      "weight": 10,
      "artifact": "architecture-plan.json",
      "collection": "modules",
      "match": {
        "name": "kv260_adaptive_threshold"
      },
      "field": "owner",
      "operator": "equals",
      "expected": "vivado_rtl_engineer"
    },
    {
      "id": "SEM-PLATFORM",
      "weight": 10,
      "artifact": "architecture-plan.json",
      "collection": "work_packages",
      "field": "agent",
      "operator": "contains",
      "expected": "amd_soc_platform_integrator"
    },
    {
      "id": "SEM-NO-HLS",
      "weight": 10,
      "artifact": "architecture-plan.json",
      "collection": "work_packages",
      "field": "agent",
      "operator": "not_contains",
      "expected": "vitis_hls_engineer"
    }
  ],
  "score_weights": {
    "contracts": 10,
    "semantics": 40,
    "simulation": 30,
    "vivado": 20
  }
}
