{
  "schema_version": 1,
  "id": "kv260_rgb_to_grayscale",
  "title": "KV260 AXI4-Stream RGB888 to BT.601 grayscale",
  "prompt_file": "prompt.md",
  "target": {
    "part": "xck26-sfvc784-2LV-c",
    "board_part": "xilinx.com:kv260_som:part0:1.4",
    "vivado_version": "2025.2"
  },
  "expected_route": [
    "amd_soc_orchestrator",
    "amd_soc_intent_to_spec",
    "amd_soc_architect",
    "vivado_rtl_engineer",
    "amd_soc_platform_integrator",
    "amd_soc_verifier",
    "vivado_impl_closure"
  ],
  "candidate": {
    "integration_mode": "ip_integrator",
    "top": "kv260_rgb_to_grayscale",
    "simulation_top": "kv260_rgb_to_grayscale",
    "rtl_sources": ["rtl/kv260_rgb_to_grayscale.sv"],
    "constraint_sources": []
  },
  "public_interface": {
    "design_root": "design",
    "modules": [{
      "name": "kv260_rgb_to_grayscale",
      "source": "rtl/kv260_rgb_to_grayscale.sv",
      "roles": ["simulation_top", "required_component"],
      "parameters": [],
      "ports": [
        {"name": "clk", "direction": "input", "width": 1},
        {"name": "rst_n", "direction": "input", "width": 1},
        {"name": "s_axis_tvalid", "direction": "input", "width": 1},
        {"name": "s_axis_tready", "direction": "output", "width": 1},
        {"name": "s_axis_tdata", "direction": "input", "width": 24},
        {"name": "s_axis_tuser", "direction": "input", "width": 1},
        {"name": "s_axis_tlast", "direction": "input", "width": 1},
        {"name": "m_axis_tvalid", "direction": "output", "width": 1},
        {"name": "m_axis_tready", "direction": "input", "width": 1},
        {"name": "m_axis_tdata", "direction": "output", "width": 8},
        {"name": "m_axis_tuser", "direction": "output", "width": 1},
        {"name": "m_axis_tlast", "direction": "output", "width": 1}
      ]
    }],
    "constraints": []
  },
  "simulation": {
    "make_directory": "testbench",
    "toplevel": "kv260_rgb_to_grayscale"
  },
  "semantic_rubric": [
    {"id": "SEM-KERNEL-RTL", "weight": 10, "artifact": "architecture-plan.json", "collection": "modules", "match": {"name": "kv260_rgb_to_grayscale"}, "field": "implementation", "operator": "equals", "expected": "rtl"},
    {"id": "SEM-CLOCK", "weight": 10, "artifact": "architecture-plan.json", "collection": "clock_domains", "field": "frequency_hz", "operator": "contains", "expected": 100000000},
    {"id": "SEM-PLATFORM", "weight": 10, "artifact": "architecture-plan.json", "collection": "work_packages", "field": "agent", "operator": "contains", "expected": "amd_soc_platform_integrator"},
    {"id": "SEM-NO-HLS", "weight": 10, "artifact": "architecture-plan.json", "collection": "work_packages", "field": "agent", "operator": "not_contains", "expected": "vitis_hls_engineer"}
  ],
  "score_weights": {"contracts": 10, "semantics": 40, "simulation": 30, "vivado": 20}
}
