{
  "schema_version": 1,
  "id": "kv260_audio_channel_router",
  "title": "KV260 stereo audio channel router",
  "prompt_file": "prompt.md",
  "target": {
    "part": "xck26-sfvc784-2LV-c",
    "board_part": "xilinx.com:kv260_som:part0:1.4",
    "vivado_version": "2025.2"
  },
  "expected_route": [
    "amd_soc_orchestrator",
    "amd_soc_intent_to_spec",
    "amd_soc_architect",
    "vivado_rtl_engineer",
    "amd_soc_platform_integrator",
    "amd_soc_verifier",
    "vivado_impl_closure"
  ],
  "candidate": {
    "integration_mode": "ip_integrator",
    "top": "kv260_system_wrapper",
    "simulation_top": "kv260_audio_channel_router",
    "rtl_sources": ["rtl/kv260_audio_channel_router.sv"],
    "constraint_sources": []
  },
  "public_interface": {
    "design_root": "design",
    "modules": [{
      "name": "kv260_audio_channel_router",
      "source": "rtl/kv260_audio_channel_router.sv",
      "roles": ["simulation_top", "required_component"],
      "parameters": [],
      "ports": [
        {"name": "clk", "direction": "input", "width": 1},
        {"name": "rst_n", "direction": "input", "width": 1},
        {"name": "route_select", "direction": "input", "width": 2},
        {"name": "s_valid", "direction": "input", "width": 1},
        {"name": "s_ready", "direction": "output", "width": 1},
        {"name": "left_in", "direction": "input", "width": 16},
        {"name": "right_in", "direction": "input", "width": 16},
        {"name": "m_valid", "direction": "output", "width": 1},
        {"name": "m_ready", "direction": "input", "width": 1},
        {"name": "left_out", "direction": "output", "width": 16},
        {"name": "right_out", "direction": "output", "width": 16}
      ]
    }],
    "constraints": []
  },
  "simulation": {"make_directory": "testbench", "toplevel": "kv260_audio_channel_router"},
  "semantic_rubric": [
    {"id": "SEM-RTL", "weight": 10, "artifact": "architecture-plan.json", "collection": "modules", "match": {"name": "kv260_audio_channel_router"}, "field": "implementation", "operator": "equals", "expected": "rtl"},
    {"id": "SEM-OWNER", "weight": 10, "artifact": "architecture-plan.json", "collection": "modules", "match": {"name": "kv260_audio_channel_router"}, "field": "owner", "operator": "equals", "expected": "vivado_rtl_engineer"},
    {"id": "SEM-PLATFORM", "weight": 10, "artifact": "architecture-plan.json", "collection": "work_packages", "field": "agent", "operator": "contains", "expected": "amd_soc_platform_integrator"},
    {"id": "SEM-NO-HLS", "weight": 10, "artifact": "architecture-plan.json", "collection": "work_packages", "field": "agent", "operator": "not_contains", "expected": "vitis_hls_engineer"}
  ],
  "score_weights": {"contracts": 10, "semantics": 40, "simulation": 30, "vivado": 20}
}
